{
  "label": "dangerous",
  "recommended_action": "avoid",
  "confidence": "high",
  "evaluated_scope": "exact_url",
  "reasons": [
    {
      "code": "synthetic_reason_one",
      "family": "synthetic_evidence",
      "severity": "low",
      "summary_key": "verdict.reason.synthetic_reason_one",
      "observed_at": "2000-01-01T00:00:01Z",
      "freshness": "current"
    },
    {
      "code": "synthetic_reason_two",
      "family": "synthetic_evidence",
      "severity": "medium",
      "summary_key": "verdict.reason.synthetic_reason_two",
      "observed_at": "2000-01-01T00:00:02Z",
      "freshness": "recent"
    },
    {
      "code": "synthetic_reason_three",
      "family": "synthetic_evidence",
      "severity": "high",
      "summary_key": "verdict.reason.synthetic_reason_three",
      "observed_at": "2000-01-01T00:00:03Z",
      "freshness": "current"
    },
    {
      "code": "synthetic_reason_four",
      "family": "synthetic_evidence",
      "severity": "advisory",
      "summary_key": "verdict.reason.synthetic_reason_four",
      "observed_at": "2000-01-01T00:00:04Z",
      "freshness": "stale"
    },
    {
      "code": "synthetic_reason_five",
      "family": "synthetic_evidence",
      "severity": "informational",
      "summary_key": "verdict.reason.synthetic_reason_five",
      "observed_at": "2000-01-01T00:00:05Z",
      "freshness": "historical"
    }
  ]
}
